,Unnamed: 0,Type,Company,NewGrade,URL,RawText
0,0,Moody,Evergrande,B2,https://www.moodys.com/research/Moodys-downgrades-Evergrandes-bond-rating-to-B2-outlook-negative--PR_212356,"


Hong Kong, January 10, 2011 -- Moody's Investors Service has today revised the outlook of Evergrande 
Real Estate Group Limited's (""Evergrande"") B1 corporate family 
rating to negative from stable. 


At the same time, Moody's has downgraded Evergrande's senior 
unsecured bond rating to B2 from B1 and has assigned a B2 senior unsecured 
rating to its proposed senior unsecured bonds.


The outlook of the senior unsecured debt rating is negative.


RATINGS RATIONALE


The rating actions follow the company's announcement that it will issue 
senior unsecured bonds to fund existing and new projects, as well 
as repayment of a portion of its onshore bank loans. The proposed 
bond wills have the same terms and covenants as and rank pari passu with 
the company's existing US$ bonds due 2015. 


""The negative outlook reflects Evergrande's increased levels 
of business and financial risks over the next 12-18 months as it 
pursues a fast expansion -- targeting sales growth of about 40% 
to RMB 70 billion -- and when Moody's expects the property 
market and bank credit environment in China to be more challenging,"" 
says Kaven Tsang, a Moody's AVP/Analyst.


""While the new bond proceeds will provide the company with funding for 
its fast growth plan and will lengthen its debt maturity profile, 
the increased debt (net of refinancing) will keep Evergrande's adjusted 
debt/capitalization at a high level of more than 60-65%, 
therefore raising its financial risk,"" says Tsang, also Moody's 
lead analyst for Evergrande. ""This ratio will weakly position 
the company at the B1 rating level"".


""The downgrade of the bond rating to B2 reflects Evergrande's 
increased legal and structural subordination risks. Its fast growth 
has resulted in a higher level of onshore debt, which has in turn 
raised its secured and subsidiary debt-to-total assets ratio 
to above 20%. Moody's does not expect such a level 
to fall, given Evergrande's ambitious business plan,"" 
says Tsang.


Furthermore, Evergrande's B1 corporate family rating continues 
to reflect its appetite for fast growth which -- as indicated -- 
attracts high development and execution risks. It also considers 
Evergrande's strengths as one of the largest developers in China, 
as measured by contracted sales, the size of its land bank, 
and its portfolio's good geographical diversification. Projected 
EBITDA interest coverage of 3-4x is also in line with its B1 peers.


Evergrande's ratings could be under pressure for downgrade if (1) 
its sales or profit margins decline because of a significant downturn 
in China's property market or an aggressive pricing strategy to pursue 
ambitious sales target; (2) liquidity declines due to continue aggressive 
land acquisitions, and/or a slowdown in sales; or (3) further 
debt is raised, resulting in adjusted debt/capitalization consistently 
above 60-65% , or EBITDA/interest under 2.5x-3x.


On the other hand, Evergrande's ratings could return to stable 
if Evergrande (1) refines its business plan to reduce its financial risk, 
such that debt leverage, measured by Debt/Total Capitalization, 
is reduced to below 60% - 65% and EBITDA/interest 
rises above 4x; and (2) maintains an adequate level of liquidity 
in support of its large scale development.


Moody's last rating action with regard to Evergrande took place on April 
14, 2010, when Moody's affirmed the B1 corporate family rating 
and senior unsecured rating following its additional US$600 million 
bond issuance.


The principal methodology used in this rating was Global Homebuilding 
Industry published in March 2009.


Evergrande Real Estate Group Limited is one of the major residential housing 
developers in China, with a standardized operating model. 
Founded in 1996 in Guangzhou, Guangdong Province, the company 
has rapidly expanded its geographic coverage to 62 cities in China in 
the past few years, and maintains a land bank of around 95.8 
million sqm in gross floor area.


REGULATORY DISCLOSURES


Information sources used to prepare the credit rating are the following: 
parties involved in the ratings, public information, and confidential 
and proprietary Moody's Investors Service information.


Moody's Investors Service considers the quality of information available 
on the issuer or obligation satisfactory for the purposes of assigning/maintaining 
a credit rating.


Moody's adopts all necessary measures so that the information it uses 
in assigning a credit rating is of sufficient quality and from sources 
Moody's considers to be reliable including, when appropriate, 
independent third-party sources. However, Moody's 
is not an auditor and cannot in every instance independently verify or 
validate information received in the rating process.


Please see ratings tab on the issuer/entity page on Moodys.com 
for the last rating action and the rating history.


The date on which some Credit Ratings were first released goes back to 
a time before Moody's Investors Service's Credit Ratings were fully digitized 
and accurate data may not be available. Consequently, Moody's 
Investors Service provides a date that it believes is the most reliable 
and accurate based on the information that is available to it. 
Please see the ratings disclosure page on our website www.moodys.com 
for further information.


Please see the Credit Policy page on Moodys.com for the methodologies 
used in determining ratings, further information on the meaning 
of each rating category and the definition of default and recovery.


Hong Kong
Kaven Tsang
Asst Vice President - Analyst
Corporate Finance Group
Moody's Investors Service Hong Kong Ltd.
JOURNALISTS: (852) 3758 -1350
SUBSCRIBERS: (852) 3551-3077


Hong Kong
Peter Choy
Senior Vice President
Corporate Finance Group
Moody's Investors Service Hong Kong Ltd.
JOURNALISTS: (852) 3758 -1350
SUBSCRIBERS: (852) 3551-3077


Moody's Investors Service Hong Kong Ltd.
24/F One Pacific Place
88 Queensway
Hong Kong
China (Hong Kong S.A.R.)
JOURNALISTS: (852) 3758 -1350
SUBSCRIBERS: (852) 3551-3077

Moody's downgrades Evergrande's bond rating to B2; outlook negative"
1,1,Fitch,Evergrande,D,https://www.fitchratings.com/research/corporate-finance/fitch-downgrades-evergrande-subsidiaries-hengda-tianji-to-restricted-default-09-12-2021,"Fitch Ratings - Hong Kong - 09 Dec 2021: Fitch Ratings has downgraded to 'RD' (Restricted Default), from 'C', the Long-Term Foreign-Currency Issuer Default Ratings (IDR) of Chinese homebuilder China Evergrande Group and its subsidiaries, Hengda Real Estate Group Co., Ltd and Tianji Holding Limited. Fitch has affirmed the senior unsecured ratings of Evergrande and Tianji at 'C', with a Recovery Rating of 'RR6', as well as the Tianji-guaranteed senior unsecured notes issued by Scenery Journey Limited at 'C', with a Recovery Rating of 'RR6'.The downgrades reflect the non-payment of coupons due 6 November 2021 for Tianji's USD645 million 13% bonds and USD590 million 13.75% bonds after the grace period lapsed on 6 December. The non-payment is consistent with an 'RD' rating, signifying the uncured expiry of any applicable grace period, cure period or default forbearance period following a payment default on a material financial obligation.Key Rating DriversNon-Payment of Coupons: There has been no announcement from the company or the trustee regarding the coupon payments due 6 November for the two Tianji bonds after the grace periods lapsed. In addition, the company did not respond to our request for confirmation on the coupon payments. We are therefore assuming they were not paid.Failure to make coupon payments within the grace period is consistent with Fitch's definition of an 'RD' rating, as the company has experienced an uncured payment default on a material financial obligation but has not yet entered into bankruptcy filings, administration, receivership, liquidation, or other formal winding-up procedures, and has not otherwise ceased operating.Cross Default with Notes: Tianji is a restricted subsidiary of Evergrande, and the non-payment has triggered an event of default on Evergrande's bonds. As a result, Tianji and Evergrande's other US dollar notes will become due immediately and payable if the bond trustee or holders of at least 25% in aggregate principal amount of the offshore notes declare so.Uncertainty over Restructuring Plan: Evergrande announced on 6 December the formation of a Risk Management Committee that comprises the company's senior management, representatives from Guangzhou state-owned enterprises, such as Guangdong Holdings Limited and Guangzhou Yuexiu Holdings Limited, as well as representatives from financial institutions such as China Cinda Asset Management Co., Ltd. (A/Stable), to mitigate and eliminate the group's future risks. There is limited information available on the company's restructuring plan at this stage.Derivation SummaryEvergrande, Hengda and Tianji's IDRs have been downgraded to 'RD' in line with our definition of an uncured payment default but there has been no initiation of bankruptcy filings, administration, receivership, liquidation, or other formal winding-up procedures as yet with business operations continuing.Key AssumptionsKEY RECOVERY RATING ASSUMPTIONSEvergrandeThe recovery analysis assumes that Evergrande would be liquidated in a bankruptcy because it is an asset-trading company. We assume both Hengda and Evergrande would go into bankruptcy if Evergrande defaults.We have assumed a 10% administrative claim.Liquidation ApproachThe liquidation estimate reflects Fitch's view of the value of balance-sheet assets that can be realised in sale or liquidation processes conducted during a bankruptcy or insolvency proceeding and distributed to creditors. - 60% advance rate applied to net inventory given EBITDA margin of below 20%- 70% advance rate applied to trade receivables, which mainly arose from sales of properties; 87% of trade receivables are within 90 days- 60% advance rate applied to property, plant and equipment (PPE), which mainly comprise buildings and construction in progress- 10% advance rate applied to investment properties based on a conservative 6.5% cap on annualised rental income.- 100% advance rate applied to available cash, but we have also added trade payables to the liability waterfallWe excluded restricted cash as there is no breakdown on how much can be used for debt repayment. The amount is immaterial.We excluded investments in joint ventures of CNY88 billion, which mainly include stakes in non-property businesses that could be illiquid, such as CNY30 billion for its 36% stake in Shengjing Bank and CNY18 billion for its 50% stake in Evergrande Life Insurance based on end-2020 breakdown. We note that the company sold a 19.9% stake in Shengjing Bank for around CNY10 billion in September 2021, but the proceeds were used to settle onshore loans from the bank.We estimate Evergrande's liquidation value by deconsolidating Hengda, Evergrande Auto and Evergrande Property Services. We estimate the residual value of Hengda and Evergrande Auto by assuming they will be liquidated as they are asset trading businesses (Evergrande Auto's electric-vehicle business remains loss-making). We expect the residual values of Hengda and Evergrande Auto to both be zero after paying off their own debt.We estimate the residual value of Evergrande's stake in Evergrande Property Services based on the going-concern approach. We applied a 4x enterprise value/EBITDA multiple and our estimated recovery value is at a 14% discount to the market value on 8 December, or 20% discount to the price that was agreed on for the disposal of the stake to Hopson Development Holdings Limited (B+/Stable) in October that was subsequently cancelled.The allocation of value in the liability waterfall results in recovery corresponding to 'RR6' for the senior unsecured notes.TianjiThe recovery analysis assumes that Tianji would be liquidated in a bankruptcy because it is an asset-trading company. We have assumed a 10% administrative claim.Liquidation ApproachThe liquidation estimate reflects Fitch's view of the value of balance-sheet assets that can be realised in sale or liquidation processes conducted during a bankruptcy or insolvency proceeding and distributed to creditors. - 60% advance rate applied to net inventory given EBITDA margin of below 20%- 70% advance rate applied to trade receivables, which mainly arose from sales of properties. - 60% advance rate applied to PPE- 10% advance rate applied to investment properties based on a conservative 6.5% cap on annualised rental income.- 100% advance rate applied to available cash, which is less than trade payablesThe allocation of value in the liability waterfall results in recovery corresponding to 'RR6' for the senior unsecured notes.RATING SENSITIVITIESFactors that could, individually or collectively, lead to positive rating action/upgrade: Factors that could, individually or collectively, lead to negative rating action/downgrade:Best/Worst Case Rating ScenarioInternational scale credit ratings of Non-Financial Corporate issuers have a best-case rating upgrade scenario (defined as the 99th percentile of rating transitions, measured in a positive direction) of three notches over a three-year rating horizon; and a worst-case rating downgrade scenario (defined as the 99th percentile of rating transitions, measured in a negative direction) of four notches over three years. The complete span of best- and worst-case scenario credit ratings for all rating categories ranges from 'AAA' to 'D'. Best- and worst-case scenario credit ratings are based on historical performance. For more information about the methodology used to determine sector-specific best- and worst-case scenario credit ratings, visit https://www.fitchratings.com/site/re/10111579.Issuer ProfileEvergrande is a top-three Chinese property developer by contracted sales. Headquartered in Shenzhen, Evergrande has a strong national presence, with 798 projects in 234 cities covering all of China's 31 provinces and municipalities. The company also has businesses in electric vehicles, finance, healthcare and cultural tourism.REFERENCES FOR SUBSTANTIALLY MATERIAL SOURCE CITED AS KEY DRIVER OF RATINGThe principal sources of information used in the analysis are described in the Applicable Criteria.ESG ConsiderationsChina Evergrande Group has an ESG Relevance Score of '4' for Governance Structure due to {DESCRIPTION OF ISSUE/RATIONALE}, which has a negative impact on the credit profile, and is relevant to the rating[s] in conjunction with other factors.Unless otherwise disclosed in this section, the highest level of ESG credit relevance is a score of '3'. This means ESG issues are credit-neutral or have only a minimal credit impact on the entity, either due to their nature or the way in which they are being managed by the entity. For more information on Fitch's ESG Relevance Scores, visit www.fitchratings.com/esgRATING ACTIONSEntity / Debt  Rating  Recovery  Prior  China Evergrande GroupLT IDRRD Downgrade C  senior unsecured  LTC AffirmedRR6 C Hengda Real Estate Group Co., LtdLT IDRRD Downgrade C Tianji Holding LimitedLT IDRRD Downgrade C  senior unsecured  LTC AffirmedRR6 C Scenery Journey Limited    senior unsecured  LTC AffirmedRR6 C PreviousPage  of 110 rows20 rows50 rows100 rows500 rowsNextLoading...VIEW ADDITIONAL RATING DETAILSAdditional information is available on www.fitchratings.comPARTICIPATION STATUSThe rated entity (and/or its agents) or, in the case of structured finance, one or more of the transaction parties participated in the rating process except that the following issuer(s), if any, did not participate in the rating process, or provide additional information, beyond the issuer’s available public disclosure. APPLICABLE CRITERIACorporate Hybrids Treatment and Notching Criteria (pub. 12 Nov 2020)Country-Specific Treatment of Recovery Ratings Rating Criteria - Effective from 5 January 2021 to 3 March 2023 (pub. 06 Jan 2021)Corporates Recovery Ratings and Instrument Ratings Criteria (pub. 09 Apr 2021) (including rating assumption sensitivity)Corporate Rating Criteria - Effective from 15 October 2021 to 28 October 2022 (pub. 16 Oct 2021) (including rating assumption sensitivity)Sector Navigators - Addendum to the Corporate Rating Criteria - Effective from 15 October 2021 to 15 July 2022 (pub. 16 Oct 2021)APPLICABLE MODELSNumbers in parentheses accompanying applicable model(s) contain hyperlinks to criteria providing description of model(s).Corporate Monitoring & Forecasting Model (COMFORT Model), v7.9.0 (1)ADDITIONAL DISCLOSURESDodd-Frank Rating Information Disclosure FormSolicitation StatusEndorsement PolicyENDORSEMENT STATUS China Evergrande Group  EU Endorsed, UK Endorsed  Hengda Real Estate Group Co., Ltd  EU Endorsed, UK Endorsed  Scenery Journey Limited  EU Endorsed, UK Endorsed  Tianji Holding Limited  EU Endorsed, UK Endorsed DISCLAIMERALL FITCH CREDIT RATINGS ARE SUBJECT TO CERTAIN LIMITATIONS AND DISCLAIMERS. PLEASE READ THESE LIMITATIONS AND DISCLAIMERS BY FOLLOWING THIS LINK: HTTPS://WWW.FITCHRATINGS.COM/UNDERSTANDINGCREDITRATINGS. IN ADDITION, THE FOLLOWING Read MoreCOPYRIGHTCopyright © 2022 by Fitch Ratings, Inc., Fitch Ratings Ltd. and its subsidiaries. 33 Whitehall Street, NY, NY 10004. Telephone: 1-800-753-4824, (212) 908-0500. Fax: (212) 480-4435. Reproduction or retransmission in whole or in part is prohibited except by permission. All rights reserved. In issuing and maintaining its ratings and in making other reportRead MoreSolicitation StatusThe ratings above were solicited and assigned or maintained by Fitch at the request of the rated entity/issuer or a related third party. Any exceptions follow below.Endorsement PolicyFitch’s international credit ratings produced outside the EU or the UK, as the case may be, are endorsed for use by regulated entities within the EU or the UK, respectively, for regulatory purposes, pursuant to the terms of the EU CRA Regulation or the UK Credit Rating Agencies (Amendment etc.) (EU Exit) Regulations 2019, as the case may be. Fitch’s approach to endorsement in    the EU and the UK can be found on Fitch’s Regulatory Affairs page on Fitch’s website. The endorsement status of international credit ratings is    provided within the entity summary page for each rated entity and in the transaction detail pages for structured finance transactions on the Fitch website. These disclosures are updated on a daily basis."
